result;sentence;response;response_formatted;corrections
false;So I think we can not live if old people could not find siences and tecnologies and they did not developped . ;I believe we wouldn't be able to live as we do today if previous generations hadn't discovered and developed various sciences and technologies .;[];['So I think we would not be alive if our ancestors did not develop sciences and technologies . ', 'So I think we could not live if older people did not develop science and technologies . ', 'So I think we can not live if old people could not find science and technologies and they did not develop . ', 'So I think we can not live if old people can not find the science and technology that has not been developed . ']
false;Here was no promise of morning except that we looked up through the trees we saw how low the forest had swung . ;There was no promise of morning , but when we looked up through the trees , we could see how low the forest had dipped .;[];['Here was no promise of morning , except that we looked up through the trees , and we saw how low the forest had swung . ', 'Here , there was no promise of morning , except that we looked up through the trees and saw how low the forest had swung . ', 'Here was no promise of morning except that we looked up through the trees and we saw how low the forest had swung . ', 'There was no promise of morning except when we looked up through the trees and saw how low the forest had swung . ']
false;Thus even today sex is considered as the least important topic in many parts of India . ;Even today , sex is often regarded as one of the least important topics in many parts of India .;[];['Thus , even today , sex is considered as the least important topic in may parts of India . ', 'Thus , even today , sex is considered the least important topic in many parts of India . ', 'Thus , even today , sex is considered the least important topic in many parts of India . ', 'Thus , even today sex is considered as the least important topic in many parts of India . ']
false;image you salf you are wark in factory just to do one thing like pot taire on car if they fire you you will destroy , becouse u dont know more than pot taire in car . ;Imagine yourself working in a factory , where your only task is to put tires on cars . If you were to lose your job , it would be devastating because you wouldn't know how to do anything else beyond installing tires on cars .;[];"[""Imagine yourself you are working in factory just to do one thing like put air a on car if they fire you you will be destroyed , because you do n't know more than to put air a in car . "", ""Imagine that you work in a factory and do just one thing , like put tires on cars ; if they fire you , they will destroy you because you do n't know how to do anything but put tires on cars . "", 'image you salf you are wark in factory just to do one thing like pot taire on car if they fire you you will destroy , becouse u dont know more than pot taire in car . ', 'Imagine yourself working in a factory. You are to do just one thing , such as put a tire on a car. If you are fired , it will destroy you because you do not know how to do more than put tires on cars . ']"
false;They draw the consumers , like me , to purchase this great product with all these amazing ingredients and all that but actually they just sometimes make something up just to increase their sales . ;They attract consumers like me to buy their products by highlighting amazing ingredients and benefits , but sometimes they fabricate claims just to boost sales .;[];['They draw in the consumers , like me , to purchase a great product with amazing ingredients , but actually , they just make up these words to increase their sales . ', 'They draw in consumers like me , who purchase this great product with all these amazing ingredients , but sometimes they just make things up to increase their sales . ', 'They draw the consumers , like me , to purchase this great product with all these amazing features , but actually sometimes they just make something up just to increase their sales . ', 'They draw the consumers , like me , to purchase this great product with all these amazing ingredients and all that , but actually they just sometimes make something up just to increase their sales . ']
false;I want to talk about nocive or bad products like alcohol , hair spray and cigarrets . ;I want to discuss harmful products such as alcohol , hair spray , and cigarettes .;[];['I want to talk about nocive or bad products like alcohol , hair spray and cigarettes . ', 'I want to talk about harmful or bad products like alcohol , hair spray and cigarettes . ', 'I want to talk about harmful or bad products like alcohol , hair spray and cigarettes . ', 'I want to talk about harmful or bad products like alcohol , hair spray and cigarettes . ']
false;For example they can play football whenever they want but the olders can not . ;For instance , they can play football whenever they want , but the older ones cannot .;[];"['For example , they can play football whenever they want , but the elders cannot . ', 'For example , they can play football whenever they want but the others can not . ', ""For example , they can play football whenever they want but the seniors ca n't . "", 'For example they can play football whenever they want but the older ones cannot . ']"
false;It figures Diana Krall wearing a Rolex watch and has a text that suggests that if the reader wants to belong to the restricted club , not necessarily of Rolex watch wearers , but of highly talented , sophisticated and competent artists , he or she should also have a Rolex . ;The advertisement features Diana Krall wearing a Rolex watch , accompanied by a message suggesting that if the reader wants to join the exclusive club—not just of Rolex wearers , but of highly talented , sophisticated , and competent artists—they should consider owning a Rolex as well .;[];['It features Diana Krall wearing a Rolex watch and the text suggests that if the reader wants to belong to a restricted club -- not necessarily of Rolex watch-wearers -- but of highly talented , sophisticated , competent artists , then he or she should also have a Rolex . ', 'Diana Krall is wearing a Rolex watch and has a text that suggests that if the reader wants to belong to a restricted club , comprised not just of Rolex watch wearers but highly talented , sophisticated and competent artists , he or she should also have a Rolex . ', 'It figures Diana Krall is wearing a Rolex watch and has a text that suggests that if the reader wants to belong to the restricted club , not necessarily of Rolex watch wearers , but of highly talented , sophisticated and competent artists , he or she should also have a Rolex . ', 'It figures Diana Krall wearing a Rolex watch and has a text that suggests that if the reader wants to belong to the restricted club , not necessarily of Rolex watch wearers , but of highly talented , sophisticated and competent artists , he or she should also have a Rolex . ']
false;Also the work of the media , television , magazines , and every stuff made for publicity affects the emotions of many people around the world , encouraging them to buy and buy anything they can . ;Additionally , the influence of media , including television , magazines , and various forms of advertising , significantly impacts the emotions of people worldwide , often encouraging them to make unnecessary purchases .;[];['Also , the work of the media , television , magazines and other things made for publicity impacts the emotions of many people around the world , encouraging them to buy everything they can . ', 'Also , the work of the media , television , magazines , and everything involved in publicity affects the emotions of people around the world , encouraging them to buy anything they can . ', 'Also , the work of media , television , magazines , and other stuff made for publicity , affects the emotions of many people around the world , encouraging them to buy and buy anything they can . ', 'Also , the work of the media , television , magazines , and everything made for publicity affects the emotions of many people around the world , encouraging them to buy and buy anything they can . ']
false;Since most urban areas are occupied with cars , they are all facing up with an irresistible problem of air and noise pollution . ;Since most urban areas are congested with cars , they all face the inescapable problems of air and noise pollution .;[];['Since most urban areas are occupied with cars , they are facing a problem of air and noise pollution . ', 'Since most urban areas are congested with cars , they all face the terrible problem of air and noise pollution . ', 'Since most urban areas are occupied with cars , they are all face upped with an irresistible problem of air and noise pollution . ', 'Since most urban areas are teeming with cars , they are all facing the unavoidable problem of air and noise pollution . ']
false;It is true that consumers preffer to buy a product that has a lower price , but when international companies that has already the certification begins to send its market , people will preffer to consume theirs because the difference between prices is probbably not going to affect them to much . ;It is true that consumers prefer to buy products with lower prices . However , when international companies with established certifications enter the market , people are likely to choose their products . This is because the price difference is probably not significant enough to influence their decision .;[];['While it is true that consumers prefer to buy products with lower prices , when international companies that are already certified begin to send their products to market , people will prefer to consume those goods because the difference in price will probably not affect them too much . ', 'It is true that consumers prefer to buy a product that has a lower price , but when international companies that already have the certification begin to send it to market , people will prefer to buy theirs because the difference between prices is probably not going to affect them too much . ', 'It is true that consumers prefer to buy a product that has a lower price , but when international companies that already have the certification begin to send it to market , people will prefer to consume theirs because the difference between prices is probably not going to affect them too much . ', 'It is true that consumers prefer to buy a product that has a lower price , but when international companies that already have the certification begin to enter the market , people will prefer to consume theirs because the difference between prices is probably not going to affect them too much . ']
false;One person if do n't have good health that means so many things they could lost . ;If a person doesn't have good health , it means they could lose many things .;[];"[""If a person does n't have good health , so many things could be lost . "", 'If one person does not have good health , that means they could lose so many things . ', ""If one person does n't have good health , that means they could lose so many things . "", ""If one person does n't have good health , that means so many things they could lose . ""]"
false;Many studies over the last 5 0 years have shown that people who have fluoride in their drinking water are considerably have less cavities than people who have not drinking nonfluoridated water . ;Numerous studies conducted over the past 50 years have demonstrated that individuals who consume fluoridated drinking water have significantly fewer cavities compared to those who drink non-fluoridated water .;[];['Many studies over the last 5 0 years have shown that people who have fluoride in their drinking water have considerably fewer cavities than people who are not drinking water with fluoride . ', 'Many studies over the last 5 0 years have shown that people who have fluoride in their drinking water are considerably have less cavities than people who have not drinking nonfluoridated water . ', 'Many studies over the last 5 0 years have shown that people who have fluoride in their drinking water are considerably less likely to have cavities than people who have non-fluoridated water . ', 'Many studies over the last 5 0 years have shown that people who have fluoride in their drinking water have considerably less cavities than people who have been drinking non-fluoridated water . ']
false;Likewise , The theory generating from the concept of memory is also not the appropriate way due to limited memory . ;Similarly , the theory derived from the concept of memory is also inadequate due to its limitations .;[];['Likewise , the theory coming from the concept of memory is also not the appropriate way due to limited memory . ', 'Likewise , the theory generated from the concept of memory is also not appropriate due to limited memory . ', 'Likewise , the theory generating from the concept of memory is also not the appropriate way due to limited memory . ', 'Likewise , the theory generating from the concept of memory is also not the appropriate way due to limited memory . ']
false;I was very fast , my best time was 5 5 seconds in 4 0 0 hundred meters is a good time in or country . ;"I was quite fast ; my best time in the 400 meters was 55 seconds , which is considered a good time in our country .";[];"['I was very fast : my best time was 5 5 seconds in 4 0 0 hundred meters , and this is a good time in my country . ', 'I was very fast ; my best time was 5 5 seconds for 4 0 0 hundred meters , and that is a good time in or out of this country . ', 'I was very fast and my best time was 5 5 seconds in 4 0 0 hundred meters is a good time in or country . ', 'I was very fast ; my best time was 5 5 seconds in 4 0 0 hundred meters. That is a good time in or country . ']"
false;If in this society who will not to do study they never concept there opportunity or ca n't understand any ideas so most of the important that in this situation and I also very interestion and also prefer that for the study material . ;In this society , those who choose not to study often miss out on opportunities and struggle to understand new ideas . Given this , I believe it is crucial to prioritize education , and I am very interested in and supportive of study materials .;[];"['In this society , those who will not study will never grasp the concepts or understand any ideas , which is the most important point ; thus I am also very interested and prefer to have the study materials . ', 'In this society , those who do not study will never have opportunities or understand ideas that are important in these situations ; I am very interested and prefer study materials . ', 'If , in this society , there are those who will not study , then they neither comprehend their opportunity nor understand any ideas most important in this situation , which I find very interesting and prefer for study material . ', ""In this society those who will not study never understand the concept nor opportunity or ca n't understand any ideas so most of the importance in that situation is lost and I am also very interesting and also prefer that for the study material . ""]"
false;We have to know this problem it 's serious but almost people doens't know about this . ;We need to recognize that this problem is serious , yet most people are unaware of it .;[];"['This is a serious problem , but most people are unaware of it . ', ""We have to know this problem is serious but most people do n't know about this . "", ""We have to know about this problem because it 's serious but most people do n't know about this . "", ""We have to know if this problem is serious but most people do n't know about it . ""]"
false;Students can focus on only a few subjects they are intwerested in and they will become an experts in those areas . ;Students can concentrate on a select few subjects that interest them , allowing them to become experts in those areas .;[];['Students can focus on only a few subjects they are interested in and they will become experts in those areas . ', 'Students can focus on only a few subjects they are interested in and they will become experts in those areas . ', 'Students can focus on only a few subjects they are interested in and they will become an expert in those areas . ', 'Students can focus on only a few subjects they are interested in and they will become an expert in those areas . ']
false;But in other waythismakes other way country need to pay extra money to make , repair the roads What they did is reduce the amount of gas consumers , high the gas tax , and low the income tax because they thought , only rise the gas tax is unfair . ;However , this approach requires the country to spend additional funds on building and repairing roads . To address this , they decided to reduce gas consumption by increasing the gas tax while lowering the income tax . They believed that raising only the gas tax would be unfair .;[];"['But in another way , this means the country needs to pay extra money to build and repair the roads ; what they did is reduce the amount of gas consumed , raise the gas tax , and lower the income tax because they thought only raising the gas tax is unfair . ', 'But in other ways this makes the other country need to pay extra money to make , repair the roads What they did is reduce the amount of gas consumers , raise the gas tax , and low the income tax because they thought , only raising the gas tax is unfair . ', 'But in other ways , this creates another way for the country to make extra money to repair the roads ; they did this by reducing the amount of gas consumed by raising the gas tax , and they lowered the income tax because they thought that only raising the gas tax was unfair . ', 'But in other ways , this caused the country to need to pay extra money to make and repair the roads. What they did was reduce the amount of gas consumers , increase the gas tax , and lower the income tax because they thought that only increasing the gas tax would have been unfair . ']"
false;Today , MBA students with a background in engineering are in high demand . ;Today , MBA students who have an engineering background are in high demand .;[];['Today , MBA students with a background in engineering are in high demand . ', 'Today , MBA students with a background in engineering are in high demand . ', 'Today , MBA students with a background in engineering are in high demand . ', 'Today , MBA students with a background in engineering are in high demand . ']
false;In the case of young people the best way is studying as hard as possible to get better grades so in the future they will have better chance to find better jobs . ;For young people , the best approach is to study diligently to achieve higher grades , which will enhance their chances of securing better jobs in the future .;[];['In the case of young people , the best way is to study as hard as possible to get better grades so in the future they will have a better chance to find a good job . ', 'In the case of young people , the best way to get better grades and thus have a chance to find better jobs in the future is to study as hard as possible . ', 'In the case of young people , the best way is to study as hard as possible and get better grades so that in the future they will have a better chance of finding good jobs . ', 'In the case of young people , the best way is studying as hard as possible to get better grades so in the future they will have better chances to find better jobs . ']
false;So the school try learning the students a bit in every science exist . ;The school aims to teach students a little about every branch of science .;[];['So the school tries teaching the students a bit of every science which exists . ', 'So the school tried teaching the students a bit about every science that exists . ', 'The school tries to teach the students a bit of every type of science . ', 'So the school tries teaching the students a bit of every science . ']
false;Specializing in one particular subject does not suit our life in this era which is characterized by diversity and innovation ;Specializing in a single subject doesn't align with the diverse and innovative nature of our current era .;[];['Specializing in one particular subject does not suit our lives in this era which is characterized by diversity and innovation . ', 'Specializing in one particular subject does not suit life in this era -- which is characterized by diversity and innovation . ', 'Specializing in one particular subject does not suit our life in this era , which is characterized by diversity and innovation . ', 'Specializing in one particular subject does not suit our lives in this era characterized by diversity and innovation ']
false;I will explain my points of views in the following paragraphs . ;I will elaborate on my viewpoints in the following paragraphs .;[];['I will explain my point of view in the following paragraphs . ', 'I will explain my points of view in the following paragraphs . ', 'I will explain my point of views in the following paragraphs . ', 'I will explain my point of view in the following paragraphs . ']
false;These activities make the community a better place to live in and inculcate these values in all the members . ;These activities enhance the community's quality of life and instill these values in all its members .;[];['These activities make the community a better place to live and include those values in all the members . ', 'These activities make the community a better place to live in and inculcate these values in all the members . ', 'These activities make the community a better place to live in and inculcate these values in all its members . ', 'These activities make the community a better place to live in and will teach these values to all the members . ']
false;Beacuse all those broad knowledge help they to understand their major in university as well as help they to make a correct choice in specializing study . ;Because all that broad knowledge helps them understand their major in university and make the right choice in their specialized studies .;[];['All the broad knowledge helps them to understand their major in University classes , as well as help them to make a correct choice in a specialized area . ', 'Because all that broad knowledge helps them to understand their majors in university and also helps them to make the correct choice in specialized study . ', 'Because of all those broad knowledge help they to understand their major in university as well as help they to make a correct choice in specializing study . ', 'All of that broad knowledge helps them understand their university major and make a correct choice of specialty . ']
false;And it was very easy to me to understand why he always brang bad marks at home . ;It was very easy for me to understand why he always brought home bad grades .;[];['I could very easily understand why he would always bring bad marks home . ', 'And it was very easy for me to understand why he always brought bad marks home . ', 'And it was very easy for me to understand why he always brings bad marks home . ', 'And it was very easy for me to understand why he always bringing bad marks home . ']
false;Then when we went to the Science Olympiad , she could have diverse knowledges about the subects and it was not new for her to think about new things . ;When we attended the Science Olympiad , she demonstrated a broad and diverse knowledge of the subjects , and thinking about new concepts was second nature to her .;[];['Then , when we went to the Science Olympiad , she had diverse knowledge about the subjects , and it was not new for her to think about new things . ', 'Then when we went to the Science Olympiad , she had diverse knowledge about the subjects as it was not unusual for her to think about new things . ', 'Then , when we went to the Science Olympiad , she could have diverse knowledge about the subjects and it was not new for her to think about new things . ', 'Then , when we went to the Science Olympiad , she would have diverse knowledge about the subjects and it would not be new for her to think about new things . ']
false;If every people thinks to learn and understand lots of scientifc subjects , any person will do not do it and as a result of this any science is n't imporeved . ;If everyone thinks about learning and understanding a wide range of scientific subjects , no one will actually do it , and as a result , scientific progress will not be made .;[];"['If every person tries to learn and understand lots of scientific subjects , no person will do it and , as a result of this , no science will be improved . ', ""If every person seeks to learn and understand many scientific subjects , and anyone can or ca n't do it , then the result will be that science wo n't improve . "", 'If every person tries to learn and understand lots of scientific subjects , the result will be improvements in every science . ', ""If every person wants to learn and understand lots of scientific subjects , not every person will be able to do it and as a result of this science is n't improved . ""]"
