result;sentence;response;response_formatted;corrections
false;Thus in concordance with the above I agree whole heartedly that in twenty years there will be fewer cars in use than there are today . ;Therefore , in line with the points mentioned above , I wholeheartedly agree that there will be fewer cars in use twenty years from now compared to today .;[];['Thus I agree wholeheartedly with the above : in twenty years there will be fewer cars in use than there are today . ', 'Thus , in concordance with the above , I agree wholeheartedly that in twenty years there will be fewer cars in use than there are today . ', 'Thus in concordance with the above , I agree wholeheartedly that in twenty years there will be fewer cars in use than there are today . ', 'Thus in accordance with the above I agree wholeheartedly that in twenty years there will be fewer cars in use than there are today . ']
false;Third the butt it in hte front of the door of store to make the poeple see it even if it is not good ;Third , place the butt in front of the store's door to ensure people notice it , even if it isn't particularly appealing .;[];['Third , put it in the front of the door of the store so people see it , even if it is not good . ', 'Third , they put it in front of the door of the store so that people will see it even if it is no good . ', 'Third , they put it in front of the door of the store to make the people see it , even if it is not good . ', 'Third , the butt in the front of the door of the store to make the people see it even if it is not good . ']
false;Very soon they will run out at the current rate of utilisation . ;At the current rate of utilization , they will run out very soon .;[];['They will run out very soon at the current rate of utilization . ', 'Soon they will run out , based on the current rate of utilization . ', 'Very soon they will run out at the current rate of utilization . ', 'Very soon they will run out at the current rate of utilization . ']
false;In the lecture , however , professor oppose the reading statement . ;In the lecture , however , the professor opposes the statement made in the reading .;[];['In the lecture , however , the professor opposed reading the statement . ', 'In the lecture , however , the professor opposed the statement in the reading . ', 'In the lecture , however , the professor opposed the reading statement . ', 'In the lecture , however , the professor opposed the reading statement . ']
false;Inorder to do this , they would need to learn additionally skills , either theoretical or practical , that would increase their understanding and future application of their chosen subject . ;To achieve this , they would need to acquire additional skills , both theoretical and practical , which would enhance their understanding and future application of their chosen subject .;[];['In order to do this , they would need to learn additional skills , either theoretical or practical , that would increase their understanding and application of their chosen subject . ', 'In order to do this , they would need to learn additional skills , either theoretical or practical , that would increase their understanding and future application of their chosen subject . ', 'In order to do this , they need to learn additional skills , either theoretical or practical , that will increase their understanding and the future application of their chosen subjects . ', 'In order to do this , they would need to learn additionally skills , either theoretical or practical , that would increase their understanding and future application of their chosen subject . ']
false;if you want a product you give create a beautiful image around it if you want sell it . ;If you want to sell a product , create a beautiful image around it .;[];['if you want to develop a product you create a beautiful image around it if you want sell it . ', 'If you want to sell a product , you must create a beautiful image around it . ', 'If you want to sell a product , you create a beautiful image around it . ', 'If you want a product , you give a create a beautiful image around it if you want sell it . ']
false;Secondly the place of the film must must be very clear and chir must be relax etc . ;Secondly , the setting of the film must be very clear , and the atmosphere should be relaxed .;[];['Secondly , the location of the film must must be very clear and the director must be relaxed , etc . ', 'Second , the place that is being filmed must be very clear and the chin must be relaxed , etc . ', 'Secondly , the place of the film must be very clear and chaimust be relax etc . ', 'Secondly , the place of the film must must be very clear and have chairs to relax , etc . ']
false;this will the proof of speeding offense so that polices can easily catch them. . ;This will serve as proof of a speeding offense , enabling the police to easily apprehend the offenders .;[];['This will prove the speeding offense so that the police can easily catch them . ', 'This will be the proof of speeding offense so that the police can easily catch them . ', 'This will be the proof of the speeding offense so that the police can easily catch them . ', 'This will be the proof of the speeding offense so that the police can easily catch them . ']
false;I never have stopped myself to think this , but this is a real possibility for the fucture . ;I've never stopped to consider this before , but it is a real possibility for the future .;[];['I have never stopped myself to think this , but this is a real possibility for the future . ', 'I have never stopped to think about this , but this is a real possibility for the future . ', 'I never have stopped myself to think this , but this is a real possibility for the future . ', 'I never have stopped to think about this , but this is a real possibility for the future . ']
false;Young has his own field and word on it hard , and do more benefits to the society . ;Young has his own field and works hard in it , contributing significantly to society .;[];['Young has his own field and works hard on it , and it provides more benefits to society . ', 'Young has his own field and works hard to do more benefit to the society . ', 'Young has his own field , has worked on it hard , and does more to benefit to the society . ', 'Young has his own field and works hard on it and benefits society . ']
false;If we conseder an idea as a totally autonomous concept within the individual process of defining reality , I will state that ideas are useless , not being based on experience . ;If we consider an idea as a completely autonomous concept within the individual's process of defining reality , I would argue that ideas are useless if they are not grounded in experience .;[];"['If we consider an idea as a totally autonomous concept within the individual process of defining reality , I think the ideas are useless , and not based on experience . ', 'If we consider an idea as a totally autonomous concept within the individual process of defining reality , I believe that ideas are useless , because they are not based on experience . ', ""If we think of an idea as a totally autonomous concept within the individual 's process of defining reality , I will state that ideas are useless , given that they are not based on experience . "", 'If we consider an idea as a totally autonomous concept within the individual process of defining reality , I would state that ideas are useless , if not based on experience . ']"
false;He/she wants to know everything about the universe , wants to know everything about the God , the death etc. these some concepts that everyone can encourage a lot of ideas but the facts are not found yet . ;They have an insatiable curiosity about the universe , God , death , and other profound concepts . While these topics can inspire a multitude of ideas , definitive answers remain elusive .;[];"['He or she wants to know everything about the universe , God , and death , these are some concepts that everyone can encourage ideas , but no facts have been found yet . ', 'He/she wants to know everything about the universe , God , death , etc. ; these are concepts that encourage a lot of ideas , but the facts have not been found yet . ', 'He/she wants to know everything about the universe , everything about God , death etc. ; these same concepts that encourage a lot of ideas but the facts are not found yet . ', 'He/she wants to know everything about the universe , wants to know everything about God , death , etc. and some of these concepts that can encourage a lot of ideas , but the facts are not found yet . ']"
false;It so expensive that only those people can do this besides of their allday living . ;It is so expensive that only those who can afford it on top of their everyday living expenses are able to do it .;[];"['It so expensive that only those people can do this , factoring in their daily living expenses . ', 'It is so expensive that it is the only thing those people can do besides their daily living . ', ""It 's so expensive that only those people can do this besides their everyday living . "", 'It is so expensive that only those people can do this outside of their normal lives . ']"
false;They make very high profits year after yaer and the numbers also increase year after year . ;They consistently achieve high profits , with numbers increasing year after year .;[];['They make very high profits year after year and the numbers also increase year after year . ', 'They make very high profits year after year and their numbers also increase year after year . ', 'They make very high profits year after year and the numbers also increase year after year . ', 'They make very high profits year after year and the numbers also increase year after year . ']
false;For this reason , the number of cars would be decrease in the future . ;For this reason , the number of cars is expected to decrease in the future .;[];['For this reason , the number of cars would decrease in the future . ', 'For this reason , the number of cars will decrease in the future . ', 'For this reason , the number of cars would decrease in the future . ', 'For this reason , the number of cars would be decreased in the future . ']
false;So he took upon himself to narrow his research on this subject which was a mystery to the world . ;So , he decided to focus his research on this subject , which remained a mystery to the world .;[];['So he took it upon himself to narrow his research on this subject , which was a mystery to the world . ', 'So he took it upon himself to narrow his research to a subject which was a mystery to the world . ', 'So he took it upon himself to narrow his research on this subject , which was a mystery to the world . ', 'So , he took it upon himself to narrow his research on the subject , which was a mystery to the world . ']
false;Others who do n't have this concept they will sell uncerfied wood . ;Others who lack this understanding may sell uncertified wood .;[];"[""Others who do n't understand this concept sell uncertified wood . "", ""Others who do n't understand this concept will sell uncertified wood . "", ""Others who do n't understand this concept will sell uncertified wood . "", ""Others do n't have this concept and they will sell uncertified wood . ""]"
false;If there are specialized docters , the docter has done the operation very often before , so he is really talented in his job . ;When there are specialized doctors , they have performed the operation numerous times before , making them highly skilled in their field .;[];['If there are specialized doctors that have done the operation often , he becomes talented in his job . ', 'If there are specialized doctors , it means that the doctor has done the operation many times before and is very talented at his job . ', 'If they are specialized doctors , the doctor has done the operation very often before , so he is really talented in his job . ', 'If there are specialized doctors that have done the operation many times before , they are really talented in their jobs . ']
false;Also , I have traveled in a group without tour guide . ;Additionally , I have traveled in a group without a tour guide .;[];['Also , I have traveled in a group without tour guide . ', 'Also , I have traveled in a group without a tour guide . ', 'Also , I have traveled in a group without a tour guide . ', 'Also , I have traveled in a group without a tour guide . ']
false;the school teachers there the one who take the future of youg genaration so we have to give them to get the better knowledge . ;The school teachers are the ones who shape the future of the younger generation , so we must ensure they receive the best knowledge and resources .;[];"['The school teachers there are the ones who create the future of the younger generation so we have to teach them better . ', ""The school teachers they 're the ones who take the future young generations so we have to support them to make younger ones more knowledgeable . "", 'the school teachers there the one who take the future of youg genaration so we have to give them to get the better knowledge . ', 'The school teachers are the ones who take care of the future of the young generation so we have to let them gain better knowledge . ']"
false;but most time it is important because most student is not baly and his think and ideas is very important . ;However , most of the time it is important because most students are not lazy , and their thoughts and ideas are very valuable .;[];['But most of the time it is important because most students are not heard and their thoughts and ideas are very important . ', 'But most of the time it is important because most student do not do badly and their thoughts and ideas are very important . ', 'Usually , it is important , because the student is not bad and his thinking and ideas are very important . ', 'but most time it is important because most student is not baly and his think and ideas is very important . ']
false;Otherwise , it will be a problem for us to understand certain thing in life . ;Otherwise , it will be difficult for us to understand certain aspects of life .;[];['Otherwise , it will be a problem for us to understand certain things in life . ', 'Otherwise , it will be a problem for us to understand certain things in life . ', 'Otherwise , it will be hard for us to understand certain things in life . ', 'Otherwise , it will be a problem for us to understand certain things in life . ']
false;I myself like to participate in kind of activities and meet many people who would like to do . ;I enjoy participating in these kinds of activities and meeting others who share the same interests .;[];['I myself like to participate in these kinds of activities and meet many people who like to do the same thing . ', 'I personally like to participate in all kinds of activities and meet many people like to as well . ', 'I myself like to participate in this kind of activities and meet many people who would like to do them . ', 'I myself like to participate in these kinds of activities and meet many people who would also like to do this . ']
false;He mainly concetrate on the questions asked him at the time of interview . ;He primarily focused on the questions asked during the interview .;[];['He mainly concentrated on the questions that were asked of him at the time of the interview . ', 'He mainly concentrated on the questions that he was asked at the time of the interview . ', 'He mainly concentrates on the questions asked him at the time of the interview . ', 'He mainly concentrated on the questions asked of him at the time of the interview . ']
false;becaese when we learn about some subjects we should have more information about what we study so that the student will get the information more easier and more better and this is my first reason . ;Because when we learn about certain subjects , having more information helps students understand the material more easily and effectively . This is my first reason .;[];['My first reason is that when we learn about some subjects we should have more information about what we study so that we will learn easier and more effectively . ', 'First , when we learn about some subjects we should have more information about what we study , and students will get information more easily and proficiently . ', 'My first reason is that when we learn about certain subjects we should have more information about what we are studying so that students will get the information more easily and in a better way . ', 'Because when we learn about some subjects we should have more information about what we study so that the students will get the information easier and better and this is my first reason . ']
false;In a market economy the price must reflect costs of the product and consumer 's willingness to buy the product . ;In a market economy , the price of a product must accurately reflect both the costs of production and the consumer's willingness to purchase it .;[];"[""In a market economy , the price must reflect the cost of the product and the consumer 's willingness to buy the product . "", ""In a market economy the price must reflect the cost of the product and the consumer 's willingness to buy it . "", ""In a market economy , the price must reflect costs of the product and consumer 's willingness to buy the product . "", ""In a market economy , the price must reflect costs of the product and consumers ' willingness to buy the product . ""]"
false;some tour guide who will want to set maximum security make tour difficult because you will only have a wonderful view throught the bus . ;A tour guide focused on maximum security might make the tour less enjoyable , as you'll be limited to viewing the sights from inside the bus .;[];['Some tour guide will want to set maximum security to make the tour difficult because you will only have a wonderful view through the bus . ', 'Some tour guides will want to ensure maximum security , which will make the tour difficult because you will only have a wonderful view through a bus window . ', 'Some tour guides , who will want to set maximum security , make the tour difficult because you will only have a wonderful view of the bus . ', 'some tour guide who will want to set maximum security make tour difficult because you will only have a wonderful view throught the bus . ']
false;It is obvious that after returning i was tired and the night is meant to sleep ! . ;It’s clear that I was exhausted after returning , and nighttime is meant for sleep .;[];['It was obvious after returning that I was tired , and the night is meant to sleep ! ', 'It is obvious that after returning I was tired and the night is meant for sleeping ! . ', 'It was obvious that I was tired after returning , and the night is meant for sleep ! ', 'It is obvious that after returning , I was tired and the night is meant for sleep ! ']
false;Nowadays , we need a person who are capable of all sorts of works . ;Nowadays , we need individuals who are capable of handling a variety of tasks .;[];['Nowadays , we need a person who is capable of all sorts of work . ', 'Nowadays , we need a person who is capable of all sorts of works . ', 'Nowadays , we need a person who is capable of all sorts of works . ', 'Nowadays , we need a person who is capable of all sorts of works . ']
false;Finally , fish farming relates to long term wastefulness whcih can pollute the sea . ;Finally , fish farming contributes to long-term wastefulness , which can lead to sea pollution .;[];['Finally , fish farming relates to long-term wastefulness , which can pollute the sea . ', 'Finally , fish farming is related to long term wastefulness which can pollute the sea . ', 'Finally , fish farming relates to long term wastefulness , which can pollute the sea . ', 'Finally , fish farming relates to long-term wastefulness which can pollute the sea . ']
false;Establishing connections with other researchers will open the door for new projects with other researchers . ;Establishing connections with fellow researchers paves the way for collaborative projects and new opportunities .;[];['Establishing connections with other researchers will open the door for new projects . ', 'Establishing connections with other researchers will open the door for new collaborative projects . ', 'Establishing connections with other researchers will open the door to new projects with other researchers . ', 'Establishing connections with other researchers will open the door for new projects with other researchers . ']
false;He knows that there is no return in his help to others . ;He understands that helping others brings no personal gain .;[];['He does not expect others to reciprocate his help . ', 'He knows that his help to others will go unreturned . ', 'He knows that his help of others will not be returned . ', 'He knows that there is no return in his help to others . ']
false;Furthermore , my friends who are nineteen years old , drive their own car , and they would like to buy always another one . ;Furthermore , my nineteen-year-old friends already drive their own cars and are always looking to buy another one .;[];['Furthermore , my friends who are nineteen years old and drive their own car. they would still like to buy another one . ', 'Furthermore , my nineteen-year-old friends drive their own cars , and they would always like to buy another one . ', 'Furthermore , my friends who are nineteen years old drive their own cars , and they always want to buy another one . ', 'Furthermore , my friends who are nineteen years old , drive their own car , but they always would like to buy another one . ']
false;As the cities were smallers , it was less violence , noise , traffic ... ;Since the cities were smaller , there was less violence , noise , and traffic .;[];['As the cities were smaller , there was less violence , noise , traffic , etc . ', 'As the cities were smaller , there was less violence , noise , traffic ... ', 'As the cities were smaller , there was less violence , noise , traffic ... ', 'As the cities were smaller , there was less violence , noise , traffic ... ']
false;Even though he knows the advertisement is unreal or looks to pretty he is going to buy the product . ;Even though he knows the advertisement is unrealistic or looks too perfect , he is still going to buy the product .;[];['Even though he knows the advertisement is not real , or looks too pretty , he is going to buy the product . ', 'Even though he knows the advertisement is unrealistic and looks too pretty , he is going to buy the product . ', 'Even though he knows the advertisement is unrealistic and looks too pretty , he is going to buy the product . ', 'Even though he knows the advertisement is unreal and looks too pretty he is going to buy the product anyway . ']
false;These are several opposing points I observed between lecture and passage . ;Here are several contrasting points I noticed between the lecture and the passage .;[];['These are several opposing points I observed between the lecture and the passage . ', 'These are several opposing viewpoints I observed between the lecture and the passage . ', 'There are several opposing points I observed between the lecture and passage . ', 'These are several opposing points that I observed between lecture and passage . ']
false;Even though she does not have job , she also need car to use pick up her kids or go shopping . ;Even though she doesn't have a job , she still needs a car to pick up her kids and go shopping .;[];['Even though she does not have a job , she also needs a car to pick up her kids or go shopping . ', 'Even though she does not have job , she also needs a car to use to pick up her kids or go shopping . ', 'Even though she does not have a job , she also needs a car to pick up her kids or go shopping . ', 'Even though she does not have a job , she also needs a car to use to pick up her kids or go shopping . ']
false;"It kept Anasazi from living in American Southwest by very high temparture ; it caused droughts . ";The extremely high temperatures in the American Southwest prevented the Anasazi from living there , as they led to severe droughts .;[];"['It kept Anasazi from living in the American southwest with very high temperatures and caused droughts . ', 'Asasazi were kept from living in the American Southwest by very high temperatures , which often caused droughts . ', 'High temperatures kept Anasazi from living in the American Southwest ; there were droughts . ', 'It kept Anasazi from living in American Southwest because of very high temperatures which caused droughts . ']"
false;Because one time you get success and next time will why not ? ;Because if you achieve success once , there's no reason you can't do it again .;[];"['Once you get success why would you not get it next time ? ', 'Because if one time you are successful , then the next time -- well , why not ? ', ""Because one time you get success and next time you wo n't . "", 'Because one time you get success and the next time will why not ? ']"
false;While at university , he might specialize in a subject , while still taking a number of diverse other courses . ;While at university , he may specialize in a particular subject while still taking a variety of other diverse courses .;[];['While at university , he might specialize in one subject while still taking a number of other diverse courses . ', 'While at University , he might specialize in a subject , while still taking a number of diverse other courses . ', 'While at university , he might specialize in a subject , while still taking a number of diverse courses . ', 'While at university , he might specialize in a subject while still taking a number of other courses . ']
